{
  "$schema": "https://json-schema.org/draft/2020-12/schema",
  "$id": "https://raw.githubusercontent.com/conuti-gmbh/bo4e-schema/master/schemas/v1/bo/Zaehler.schema.json",
  "title": "Zaehler",
  "type": "object",
  "properties": {
    "boTyp": {
      "$ref": "../enum/BOTyp.schema.json",
      "default": "ZAEHLER"
    },
    "versionStruktur": {
      "type": "string",
      "default": "1",
      "description": "versionStruktur"
    },
    "zaehlernummer": {
      "type": "string",
      "faker": {
        "string.binary": {
          "prefix": "ZAEHLER_",
          "length": 6
        }
      },
      "description": "Nummerierung des Zählers, vergeben durch den Messstellenbetreiber"
    },
    "sparte": {
      "$ref": "../enum/Sparte.schema.json",
      "description": "Strom oder Gas."
    },
    "zaehlerauspraegung": {
      "$ref": "../enum/Zaehlerauspraegung.schema.json",
      "description": "Spezifikation die Richtung des Zählers betreffend."
    },
    "zaehlertyp": {
      "$ref": "../enum/Zaehlertyp.schema.json",
      "description": "Typisierung des Zählers"
    },
    "tarifart": {
      "$ref": "../enum/Tarifart.schema.json",
      "description": "Spezifikation bezüglich unterstützter Tarifarten."
    },
    "zaehlerkonstante": {
      "type": "number",
      "format": "float",
      "faker": {
        "number.float": {
          "multipleOf": 0.5,
          "min": 10,
          "max": 30
        }
      },
      "description": "Zählerkonstante auf dem Zähler."
    },
    "eichungBis": {
      "type": "string",
      "format": "date-time",
      "description": "Bis zu diesem Datum ist der Zähler geeicht."
    },
    "zaehlerhersteller": {
      "$ref": "../bo/Geschaeftspartner.schema.json",
      "description": "Der Hersteller des Zählers. Details Geschaeftspartner"
    },
    "gateway": {
      "type": "string",
      "description": "Angabe eines SMGW, mit dem der Zaehler parametrisiert ist",
      "faker": {
        "string.binary": {
          "prefix": "GATEWAY_",
          "length": 6
        }
      }
    },
    "fernschaltung": {
      "$ref": "../enum/Fernschaltung.schema.json",
      "description": "Fernschaltung"
    },
    "messwerterfassung": {
      "$ref": "../enum/Messwerterfassung.schema.json",
      "description": "Messwerterfassung am Zählpunkt"
    },
    "zaehlertypspezifikation": {
      "$ref": "../enum/ZaehlertypSpezifikation.schema.json",
      "description": "Typisierung des Zählers (spezifikation für EHZ und MME)"
    },
    "befestigungsart": {
      "$ref": "../enum/Befestigungsart.schema.json",
      "description": "Befestigungsart"
    },
    "zaehlergroesse": {
      "$ref": "../enum/Geraetemerkmal.schema.json",
      "description": "Zaehlergroesse"
    },
    "mengenumwertertyp": {
      "$ref": "../enum/Mengenumwertertyp.schema.json"
    },
    "volumenerfassung": {
      "$ref": "../enum/Volumenerfassung.schema.json"
    },
    "serialnummer": {
      "type": "string",
      "faker": {
        "string.numeric": 10
      },
      "description": "serialnummer"
    },
    "geraetemerkmal": {
      "$ref": "../enum/Geraetemerkmal.schema.json",
      "description": "Weitere Merkmale des Geräts, zum Beispiel Mehrtarif, Eintarif etc.. Details Geraetemerkmal"
    },
    "herstellungsdatum": {
      "type": "string",
      "format": "date-time",
      "description": "herstellungsdatum"
    },
    "baujahr": {
      "type": "string",
      "$comment": "DTM+Z03",
      "description": "baujahr"
    },
    "messlokationsId": {
      "type": "string",
      "faker": {
        "string.numeric": 33
      },
      "description": "messlokationsId"
    },
    "marktlokationsId": {
      "type": "string",
      "faker": {
        "string.numeric": 11
      },
      "description": "marktlokationsId"
    },
    "geraete": {
      "type": "array",
      "items": {
        "$ref": "../com/Geraet.schema.json"
      },
      "description": "Liste der Geräte, die zu diesem Zähler gehören."
    },
    "zaehlwerke": {
      "type": "array",
      "items": {
        "$ref": "../com/Zaehlwerk.schema.json"
      },
      "description": "Die Zählwerke des Zählers."
    },
    "datenqualitaet": {
      "$ref": "../enum/Datenqualitaet.schema.json"
    },
    "gueltigkeitszeitraum": {
      "$ref": "../com/Zeitraum.schema.json"
    }
  },
  "required": [
    "boTyp",
    "versionStruktur"
  ]
}
