{
  "boTyp": "ZAEHLER",
  "versionStruktur": "1",
  "zaehlernummer": "ZAEHLER_110111",
  "sparte": "ABWASSER",
  "zaehlerauspraegung": "EINRICHTUNGSZAEHLER",
  "zaehlertyp": "TURBINENRADGASZAEHLER",
  "tarifart": "LEISTUNGSGEMESSEN",
  "zaehlerkonstante": 21,
  "eichungBis": "7027",
  "zaehlerhersteller": {
    "boTyp": "GESCHAEFTSPARTNER",
    "versionStruktur": "1",
    "anrede": "Dr.",
    "name1": "Reichel",
    "name2": "Frida",
    "name3": "dolore minim in",
    "name4": "Ut do anim fugiat minim",
    "umsatzsteuerId": "DE001101110",
    "glaeubigerId": "631099",
    "emailAdresse": "Liv_Thieke@hotmail.com",
    "website": "https://herausragend-milchstrae.com/",
    "gewerbekennzeichnung": true,
    "hrnummer": "253971",
    "amtsgericht": "Bad Artur",
    "partneradresse": {
      "postleitzahl": "90304",
      "ort": "Gelsenkirchen",
      "strasse": "Kunstfeldstr.",
      "hausnummer": "16",
      "postfach": "laboris nostrud voluptate aliquip pariatur",
      "adresszusatz": "in fugiat",
      "coErgaenzung": "ad culpa nisi dolore consequat",
      "landescode": "NL",
      "ortsteil": "Speyer",
      "zusatzInformation": {
        "zusatz1": "voluptate Excepteur pariatur in",
        "zusatz2": "proident adipisicing Excepteur dolor",
        "zusatz3": "in",
        "zusatz4": "sit dolor",
        "zusatz5": "adipisicing"
      }
    },
    "externeKundenummerLieferant": "475410",
    "externeReferenzen": [
      {
        "exRefName": "Kundennummer beim Altlieferanten",
        "exRefWert": "6546732438"
      }
    ],
    "geschaeftspartnerrolle": [
      "DIENSTLEISTER"
    ],
    "kontaktweg": [
      "SMS"
    ],
    "ansprechpartner": {
      "boTyp": "ANSPRECHPARTNER",
      "versionStruktur": "1",
      "nachname": "Nitzsche",
      "eMailAdresse": "Ole10@hotmail.com",
      "rufnummern": [
        {
          "nummerntyp": "RUF_ZENTRALE",
          "rufnummer": "+49-9381-51966239"
        }
      ]
    }
  },
  "gateway": "GATEWAY_010111",
  "fernschaltung": "NICHT_VORHANDEN",
  "messwerterfassung": "FERNAUSLESBAR",
  "zaehlertypspezifikation": "MME_MEDA",
  "befestigungsart": "EINSTUTZEN",
  "zaehlergroesse": "GAS_G1600",
  "mengenumwertertyp": "DICHTEMENGENUMWERTER",
  "volumenerfassung": "HOCHFREQUENZSONDE",
  "serialnummer": "2118605314",
  "geraetemerkmal": "WASSER_VWZ07",
  "herstellungsdatum": "6691",
  "baujahr": "7116",
  "messlokationsId": "980964243790641598798980719201945",
  "marktlokationsId": "00551804105",
  "geraete": [
    {
      "geraetetyp": "VIER_QUADRANTEN_LASTGANGZAEHLER",
      "bezeichnung": "fugiat ea",
      "geraetenummer": "90103",
      "geraetereferenz": "REF_110000",
      "geraeteeigenschaften": {
        "geraetetyp": "OPTIONALE_ZUS_ZAEHLEINRICHTUNG",
        "geraetemerkmal": "GAS_G400",
        "volumenerfassung": "KENNLINIENKORREKTUR",
        "serialnummer": "5385342698",
        "herstellungsdatum": "9899",
        "baujahr": "4410",
        "eichungBis": "7951",
        "faktor": 8.25,
        "firmwareVersion": "FW_0011",
        "herstellerTypbezeichnung": "TYP_000011",
        "simKartenNummer": "97996390651363737810",
        "modemKennungIMSI": "703224349400006",
        "tkProvider": "TK_0101",
        "ipVersion": "3"
      },
      "volumenerfassung": "KENNLINIENKORREKTUR",
      "weitereGeraetenummern": [
        "30356"
      ]
    }
  ],
  "zaehlwerke": [
    {
      "zaehlwerkId": "184641158",
      "bezeichnung": "nisi officia nulla",
      "richtung": "AUSSP",
      "obisKennzahl": "consectetur nulla",
      "wandlerfaktor": 5,
      "einheit": "KUBIKMETER",
      "schwachlastfaehig": "NICHT_SCHWACHLASTFAEHIG",
      "verbrauchsart": [
        "W"
      ],
      "unterbrechbarkeit": "NUV",
      "waermenutzung": "WAERMEPUMPE",
      "konzessionsabgabe": {
        "satz": "TK",
        "kosten": 49508949.03705123,
        "kategorie": "voluptate"
      },
      "steuerbefreit": true,
      "vorkommastelle": 4,
      "nachkommastelle": 6,
      "abrechnungsrelevant": true,
      "anzahlAblesungen": 8,
      "zaehlzeiten": {
        "register": "ut esse nulla",
        "zaehlzeitDefinition": "fugiat amet id aliquip elit",
        "schwachlastfaehig": "NICHT_SCHWACHLASTFAEHIG"
      },
      "konfiguration": "dolore magna occaecat cupidatat Ut",
      "messprodukt": "mollit nulla dolore",
      "wertegranularitaet": "QUARTALSWEISE",
      "notwendigkeitZweiteMessung": "NICHT_VORHANDEN",
      "werteuebermittlungVerwendungszweck": "NICHT_VORHANDEN",
      "artEMobilitaet": "LP",
      "konfigurationsprodukt": "culpa Duis aute in",
      "keinKonfigurationsprodukt": false,
      "leistungskurvendefinition": "nostrud laboris incididunt ex",
      "verwendungszwecke": [
        {
          "marktrolle": "MSBA",
          "zweck": [
            "ENDKUNDENABRECHNUNG"
          ]
        }
      ],
      "verwendungszweckNB": "in dolor proident non",
      "verwendungszweckLF": "laborum officia Ut",
      "verwendungszweckUENB": "in",
      "keinProdukt": false
    }
  ],
  "datenqualitaet": "GUELTIGE_DATEN",
  "gueltigkeitszeitraum": {
    "zeiteinheit": "VIERTEL_STUNDE",
    "dauer": 3,
    "startdatum": "1948-01-10T20:34:53.0Z",
    "enddatum": "1921-06-09T20:47:44.0Z",
    "einheit": "VIERTEL_STUNDE",
    "ableseZeitraum": "941469",
    "abrechnungsZeitraum": "415598",
    "zeitraumText": "sed Excepteur",
    "zeitraumId": 3
  }
}